{
  "authoritative": false,
  "constituents": [
    {
      "active": true,
      "coverageStatus": "FINANCIALS",
      "enteredAt": "2026-02-02",
      "industryCode": "COAL",
      "industryName": "Coal",
      "modelFamily": "ENERGY_COAL",
      "name": "Alamtri Resources Indonesia Tbk",
      "sectorCode": "ENERGY",
      "sectorName": "Energy",
      "sourceRef": "fixture:2026-02-02:ADRO",
      "ticker": "ADRO"
    },
    {
      "active": true,
      "coverageStatus": "FINANCIALS",
      "enteredAt": "2026-02-02",
      "industryCode": "METALS_AND_MINERALS",
      "industryName": "Metals and Minerals",
      "modelFamily": "MINER",
      "name": "Amman Mineral Internasional Tbk",
      "sectorCode": "BASIC_MATERIALS",
      "sectorName": "Basic Materials",
      "sourceRef": "fixture:2026-02-02:AMMN",
      "ticker": "AMMN"
    },
    {
      "active": true,
      "coverageStatus": "FINANCIALS",
      "enteredAt": "2026-02-02",
      "industryCode": "RETAIL_STAPLES",
      "industryName": "Retail - Staples",
      "modelFamily": "CONSUMER_STAPLES",
      "name": "Sumber Alfaria Trijaya Tbk",
      "sectorCode": "CONSUMER_NON_CYCLICALS",
      "sectorName": "Consumer Non-Cyclicals",
      "sourceRef": "fixture:2026-02-02:AMRT",
      "ticker": "AMRT"
    },
    {
      "active": true,
      "coverageStatus": "FINANCIALS",
      "enteredAt": "2026-02-02",
      "industryCode": "METALS_AND_MINERALS",
      "industryName": "Metals and Minerals",
      "modelFamily": "MINER",
      "name": "Aneka Tambang Tbk",
      "sectorCode": "BASIC_MATERIALS",
      "sectorName": "Basic Materials",
      "sourceRef": "fixture:2026-02-02:ANTM",
      "ticker": "ANTM"
    },
    {
      "active": true,
      "coverageStatus": "FINANCIALS",
      "enteredAt": "2026-02-02",
      "industryCode": "INDUSTRIAL_CONGLOMERATES",
      "industryName": "Industrial Conglomerates",
      "modelFamily": "CONGLOMERATE",
      "name": "Astra International Tbk",
      "sectorCode": "INDUSTRIALS",
      "sectorName": "Industrials",
      "sourceRef": "fixture:2026-02-02:ASII",
      "ticker": "ASII"
    },
    {
      "active": true,
      "coverageStatus": "FINANCIALS",
      "enteredAt": "2026-02-02",
      "industryCode": "BANKS",
      "industryName": "Banks",
      "modelFamily": "BANK",
      "name": "Bank Central Asia Tbk",
      "sectorCode": "FINANCIALS",
      "sectorName": "Financials",
      "sourceRef": "fixture:2026-02-02:BBCA",
      "ticker": "BBCA"
    },
    {
      "active": true,
      "coverageStatus": "FINANCIALS",
      "enteredAt": "2026-02-02",
      "industryCode": "BANKS",
      "industryName": "Banks",
      "modelFamily": "BANK",
      "name": "Bank Negara Indonesia (Persero) Tbk",
      "sectorCode": "FINANCIALS",
      "sectorName": "Financials",
      "sourceRef": "fixture:2026-02-02:BBNI",
      "ticker": "BBNI"
    },
    {
      "active": true,
      "coverageStatus": "FINANCIALS",
      "enteredAt": "2026-02-02",
      "industryCode": "BANKS",
      "industryName": "Banks",
      "modelFamily": "BANK",
      "name": "Bank Rakyat Indonesia (Persero) Tbk",
      "sectorCode": "FINANCIALS",
      "sectorName": "Financials",
      "sourceRef": "fixture:2026-02-02:BBRI",
      "ticker": "BBRI"
    },
    {
      "active": true,
      "coverageStatus": "FINANCIALS",
      "enteredAt": "2026-02-02",
      "industryCode": "BANKS",
      "industryName": "Banks",
      "modelFamily": "BANK",
      "name": "Bank Mandiri (Persero) Tbk",
      "sectorCode": "FINANCIALS",
      "sectorName": "Financials",
      "sourceRef": "fixture:2026-02-02:BMRI",
      "ticker": "BMRI"
    },
    {
      "active": true,
      "coverageStatus": "FINANCIALS",
      "enteredAt": "2026-02-02",
      "industryCode": "BANKS",
      "industryName": "Banks",
      "modelFamily": "BANK",
      "name": "Bank Syariah Indonesia Tbk",
      "sectorCode": "FINANCIALS",
      "sectorName": "Financials",
      "sourceRef": "fixture:2026-02-02:BRIS",
      "ticker": "BRIS"
    },
    {
      "active": true,
      "coverageStatus": "FINANCIALS",
      "enteredAt": "2026-02-02",
      "industryCode": "CHEMICALS",
      "industryName": "Chemicals",
      "modelFamily": "CHEMICALS",
      "name": "Barito Pacific Tbk",
      "sectorCode": "BASIC_MATERIALS",
      "sectorName": "Basic Materials",
      "sourceRef": "fixture:2026-02-02:BRPT",
      "ticker": "BRPT"
    },
    {
      "active": true,
      "coverageStatus": "FINANCIALS",
      "enteredAt": "2026-02-02",
      "industryCode": "ANIMAL_FEED_AND_PROTEIN",
      "industryName": "Animal Feed and Protein",
      "modelFamily": "PROTEIN",
      "name": "Charoen Pokphand Indonesia Tbk",
      "sectorCode": "CONSUMER_NON_CYCLICALS",
      "sectorName": "Consumer Non-Cyclicals",
      "sourceRef": "fixture:2026-02-02:CPIN",
      "ticker": "CPIN"
    },
    {
      "active": true,
      "coverageStatus": "FINANCIALS",
      "enteredAt": "2026-02-02",
      "industryCode": "REAL_ESTATE_DEVELOPMENT",
      "industryName": "Real Estate Development",
      "modelFamily": "PROPERTY",
      "name": "Ciputra Development Tbk",
      "sectorCode": "PROPERTIES_AND_REAL_ESTATE",
      "sectorName": "Properties and Real Estate",
      "sourceRef": "fixture:2026-02-02:CTRA",
      "ticker": "CTRA"
    },
    {
      "active": true,
      "coverageStatus": "FINANCIALS",
      "enteredAt": "2026-02-02",
      "industryCode": "CHEMICALS",
      "industryName": "Chemicals",
      "modelFamily": "CHEMICALS",
      "name": "Essa Industries Indonesia Tbk",
      "sectorCode": "BASIC_MATERIALS",
      "sectorName": "Basic Materials",
      "sourceRef": "fixture:2026-02-02:ESSA",
      "ticker": "ESSA"
    },
    {
      "active": true,
      "coverageStatus": "FINANCIALS",
      "enteredAt": "2026-02-02",
      "industryCode": "TELECOMMUNICATION",
      "industryName": "Telecommunication",
      "modelFamily": "TELCO",
      "name": "XLSmart Telecom Sejahtera Tbk",
      "sectorCode": "INFRASTRUCTURES",
      "sectorName": "Infrastructures",
      "sourceRef": "fixture:2026-02-02:EXCL",
      "ticker": "EXCL"
    },
    {
      "active": true,
      "coverageStatus": "FINANCIALS",
      "enteredAt": "2026-02-02",
      "industryCode": "FOOD_AND_BEVERAGE",
      "industryName": "Food and Beverage",
      "modelFamily": "CONSUMER_STAPLES",
      "name": "Indofood CBP Sukses Makmur Tbk",
      "sectorCode": "CONSUMER_NON_CYCLICALS",
      "sectorName": "Consumer Non-Cyclicals",
      "sourceRef": "fixture:2026-02-02:ICBP",
      "ticker": "ICBP"
    },
    {
      "active": true,
      "coverageStatus": "FINANCIALS",
      "enteredAt": "2026-02-02",
      "industryCode": "METALS_AND_MINERALS",
      "industryName": "Metals and Minerals",
      "modelFamily": "MINER",
      "name": "Vale Indonesia Tbk",
      "sectorCode": "BASIC_MATERIALS",
      "sectorName": "Basic Materials",
      "sourceRef": "fixture:2026-02-02:INCO",
      "ticker": "INCO"
    },
    {
      "active": true,
      "coverageStatus": "FINANCIALS",
      "enteredAt": "2026-02-02",
      "industryCode": "FOOD_AND_BEVERAGE",
      "industryName": "Food and Beverage",
      "modelFamily": "CONSUMER_STAPLES",
      "name": "Indofood Sukses Makmur Tbk",
      "sectorCode": "CONSUMER_NON_CYCLICALS",
      "sectorName": "Consumer Non-Cyclicals",
      "sourceRef": "fixture:2026-02-02:INDF",
      "ticker": "INDF"
    },
    {
      "active": true,
      "coverageStatus": "FINANCIALS",
      "enteredAt": "2026-02-02",
      "industryCode": "PAPER_AND_FOREST",
      "industryName": "Paper and Forest Products",
      "modelFamily": "PULP_PAPER",
      "name": "Indah Kiat Pulp & Paper Tbk",
      "sectorCode": "BASIC_MATERIALS",
      "sectorName": "Basic Materials",
      "sourceRef": "fixture:2026-02-02:INKP",
      "ticker": "INKP"
    },
    {
      "active": true,
      "coverageStatus": "FINANCIALS",
      "enteredAt": "2026-02-02",
      "industryCode": "TELECOMMUNICATION",
      "industryName": "Telecommunication",
      "modelFamily": "TELCO",
      "name": "Indosat Tbk",
      "sectorCode": "INFRASTRUCTURES",
      "sectorName": "Infrastructures",
      "sourceRef": "fixture:2026-02-02:ISAT",
      "ticker": "ISAT"
    },
    {
      "active": true,
      "coverageStatus": "FINANCIALS",
      "enteredAt": "2026-02-02",
      "industryCode": "COAL",
      "industryName": "Coal",
      "modelFamily": "ENERGY_COAL",
      "name": "Indo Tambangraya Megah Tbk",
      "sectorCode": "ENERGY",
      "sectorName": "Energy",
      "sourceRef": "fixture:2026-02-02:ITMG",
      "ticker": "ITMG"
    },
    {
      "active": true,
      "coverageStatus": "FINANCIALS",
      "enteredAt": "2026-02-02",
      "industryCode": "ANIMAL_FEED_AND_PROTEIN",
      "industryName": "Animal Feed and Protein",
      "modelFamily": "PROTEIN",
      "name": "Japfa Comfeed Indonesia Tbk",
      "sectorCode": "CONSUMER_NON_CYCLICALS",
      "sectorName": "Consumer Non-Cyclicals",
      "sourceRef": "fixture:2026-02-02:JPFA",
      "ticker": "JPFA"
    },
    {
      "active": true,
      "coverageStatus": "FINANCIALS",
      "enteredAt": "2026-02-02",
      "industryCode": "PHARMACEUTICALS",
      "industryName": "Pharmaceuticals",
      "modelFamily": "HEALTHCARE",
      "name": "Kalbe Farma Tbk",
      "sectorCode": "HEALTHCARE",
      "sectorName": "Healthcare",
      "sourceRef": "fixture:2026-02-02:KLBF",
      "ticker": "KLBF"
    },
    {
      "active": true,
      "coverageStatus": "FINANCIALS",
      "enteredAt": "2026-02-02",
      "industryCode": "RETAIL_DISCRETIONARY",
      "industryName": "Retail - Discretionary",
      "modelFamily": "CONSUMER_DISCRETIONARY",
      "name": "Mitra Adiperkasa Tbk",
      "sectorCode": "CONSUMER_CYCLICALS",
      "sectorName": "Consumer Cyclicals",
      "sourceRef": "fixture:2026-02-02:MAPI",
      "ticker": "MAPI"
    },
    {
      "active": true,
      "coverageStatus": "FINANCIALS",
      "enteredAt": "2026-02-02",